title1,abstract1,title2,abstract2,kesamaan_abstract_jurnal
Kesehatan Masyarakat,"setiap orang berhak atas taraf hidup yang sehat dan kesejatraan dirinya sendiri dan keluarga.pentingnya kesehatan sebagai hak dan kewajiban sebagai kondisi yang diperlukan sepenuhnya.hak atas kesehatan meliputi hak untuk mendapatkan kehidupan dan pekerjaan yang sehat,dan hak untuk mendapatkan pelayanan kesehatan.",GANGGUAN KESEHATAN PADA ANAK USIA DINI AKIBAT KEKURANGAN GIZI DAN UPAYA PENCEGAHANNYA,"Kesehatan adalah hal terpenting dan sangat berharga bagi masyarakat pada umumnya untuk mewujudkan kondisi ini, diperlukan asupan gizi yang cukup. Gizi merupakan zat makanan yang apabila dikonsumsi seseorang maka bisa mendatangkan kesehatan.Jadi kesehatan dan gizi sangat berhubungan. Menyiapkan asupan gizi untuk anak usia dini merupakan hal yang penting untuk diperhatikan oleh orangtua. Karena asupan gizi yang diterima anak usia dini akan mempengaruhi proses tumbuh kembang mereka diusia dewasa kelak. Gizi pada anak tidak dapat dipisahkan dan erat kaitannya dengan kesehatan dan kecerdasan anak. Selain itu, melalui gizi yang diterima anak akan menjadi faktor pendukung dari pertumbuhan dan perkembangan anak. Tujuan penelitian ini adalah untuk meningkatkan kesadaran pendidik maupun orang tua tentang pentingnya kecukupan asupan gizi untuk Anak. Metode yang digunakan dalam penelitian ini kajian pustaka hasil dan pembahasan penelitian yang searah dengan program yang akan diterapkan. Melalui penelitian ini diharapkan dapat memberikan pemahaman kepada pendidik ataupun orang tua yang ada di rumah, sebagai bentuk kesadaran pengawasan akan asupan dan kecukupan gizi anak yang juga sebagai salah satu faktor penting pendukung dari pertumbuhan dan perkembangnnya. factor penyebab kurang gizi; 1). Penyebab langsung, Makanan anak dan penyakit infeksi yang mungkin diderita anak. 2). Penyebab tidak langsung, Ketahanan pangan di keluarga, pola pengasuhan anak, serta kesehatan dan kesehatan lingkungan. Upaya pencegahan dini pada anak yang mengalami gizi buruk; dengan prinsip-prinsip sebagai berikut: 1).Upaya perbaikan status gizi ibu sejak masa remaja. 2). Pemenuhan kebutuhan gizi balita yang dimulai dari ejak lahir dengan standar emas makanan bayi. : 3). Penapisan massal untuk menemukan hambatan pertumbuhan dan gizi kurang pada anak usia dini. 4). Perhatian khusus diberikan kepada bayi dan balita dengan factor resiko mengalami kekurangan gizi. 5). Dukungan program terkait. 6). Dukungan lintas sector. 7). Perhatian khusus diberikan kepada balita yang rentan memiliki gizi buruk. ",0.6
"PENGUATAN LITERASI, NUMERASI, DAN ADAPTASI TEKNOLOGI PADA PEMBELAJARAN DI SEKOLAH","Penguatan literasi, numerasi, dan adaptasi teknologi merupakan upaya penting untuk meningkatkan kualitas sumber daya manusia di Era Digital dan Era Disrupsi. Indonesia masih sangat jauh tertinggal dari negara lain dalam hal ini. Pemerintah beserta pihak terkait (Sekolah, Perguruan Tinggi, Lembaga Penjaminan Mutu Pendidikan, dan Orang Tua) harus turut serta dalam penguatan literasi, numerasi, dan adaptasi teknologi bagi peserta didik dan pendidik di Indonesia. Salah satu kegiatannya adalah mengintegrasikan kegiatan literasi, numerasi, dan teknologi dalam pembelajaran baik di sekolah maupun di rumah.",Analisis Pengaruh Covid-19 Terhadap Kesehatan Mental Masyarakat Di Indonesia,"Pandemi COVID-19 membawa pengaruh yang besar terhadap kesehatan masyarakat. Bukan hanya dari segi fisik, namun juga kesehatan psikis atau mental yang disebabkan oleh berbagai masalah dan kecemasan. Penelitian ini bertujuan untuk mengetahui faktor apa saja yang mempengaruhi kesehatan mental masyarakat dan mengetahui pengaruh COVID-19 terhadap kesehatan mental masyarakat Indonesia secara luas. Metode: Metode yang digunakan dalam penelitian ini adalah metode kualitatif dan studi literatur. Teknik pengumpulan data yaitu melakukan penggalian informasi berdasarkan beberapa sumber tertulis seperti buku, artikel, jurnal, majalah, serta dokumen sesuai dengan permasalahan yang dikaji.Hasil: Hasil dari penelitian ini adalah COVID-19 membawa pengaruh besar pada kesehatan fisik dan mental masyarakat di Indonesia. Adapun faktor yang mempengaruhi kesehatan mental masyarakat adalah risiko utama depresi yang muncul akibat pandemi COVID-19 antara lain: resesi ekonomi, faktor jarak dan isolasi sosial, serta stress dan trauma pada tenaga kesehatan. Pengaruh yang diakibatkan COVID-19 pada perubahan yang terjadi secara tiba-tiba, membuat masyarakat sulit beradaptasi dan menyebabkan stress hingga trauma.Simpulan: COVID-19 membawa pengaruh besar dalam kesehatan fisik dan mental masyarakat di Indonesia.",0.25
Pengaruh Sarana Prasarana Dan Pemanfaatan Teknologi Informasi Dalam Pembelajaran Terhadap Mutu Pendidikan Di Sekolah Menengah Pertama Negeri Kabupaten Lombok Utara Tahun 2022,"Penelitian ini dilakukan untuk menemukan pengaruh sarana prasarana dan pemanfaatan teknologi informasi dalam pembelajaran terhadap mutu pendidikan. Tujuan penelitian ini adalah untuk menganalisis dan menemukan perbedaan mutu pendidikan di SMP Negeri Kabupaten Lombok Utara yang memiliki perbedaan sarana prasarana dan pemanfaatan teknologi informasi dalam pembelajaran. Penelitian ini menggunakan pendekatan deskriptif kuantitatif dengan metode penelitian kausal komparatif. Populasi pada penelitian ini terdiri dari 270 orang guru ASN yang tersebar di 16 SMP Negeri Kabupaten Lombok Utara. Teknik pengambilan sampel menggunakan proportional random sampling pada tiap sub populasi dan sampel ditentukan secara random. Sampel pada penelitian ini berjumlah 160 orang guru. Uji hipotesis menggunakan Analisys of Varians (ANOVA). Hasil penelitian menunjukkan: 1) Sarana prasarana tergolong cukup (69,04%); 2) Pemanfaatan teknologi informasi dalam pembelajaran tergolong cukup (68,51%); 3) Mutu pendidikan tergolong baik (81,04%); 4) Sarana prasarana berpengaruh positif dan signifikan terhadap mutu pendidikan (p  0,005); 5) Pemanfaatan teknologi informasi dalam pembelajaran berpengaruh positif dan signifikan terhadap mutu pendidikan (p  0,005); dan 6) Tidak terdapat pengaruh interaksi sarana prasarana dan pemanfaatan teknologi informasi dalam pembelajaran terhadap peningkatan mutu pendidikan (p > 0,005).",Pengaruh pendidikan kesehatan tentang bantuan hidup dasar (BHD) terhadap tingkat pengetahuan anggota PMR di SMK N 1 Bawen,"Tindakan darurat BHD dilakukan untuk membebaskan jalan napas, membantu pernapasan dan mempertahankan sirkulasi darah tanpa menggunakan alat bantu, Kegawatdaruratan dapat terjadi kapan saja, dimana saja, dan pada siapa saja. Bagi korban memerlukan suatu bentuk pertolongan yang cepat dan tepat agar korban dapat terhindar dari bahaya maut. Ilmu pertolongan pertama pada kecelakan sebaiknya di miliki oleh anggota PMR. Salah satu upaya pemberian informasi adalah melalui penyuluhan atau pendidikan kesehatan, yang diharapkan dapat meningkatkan pengetahuan anggota PMR. Penelitian ini memiliki tujuan untuk mengetahui pengaruh pendidikan kesehatan tentang Batuan hidup dasar (BHD) terhadap tingkat pengetahuan anggota PMR di SMK N 1 Bawen Desain penelitian ini menggunakan rancangan pra eksperimen dengan pendekatan one group pre test-post test design Populasi dalam penelitian ini adalah anggota PMR di SMK N 1 Bawen sebanyak 35 orang. Tehnik sampling dalam penelitian ini adalah purposive sampling. Analisis data menggunakan analisis univariat dan bivariat menggunakan uji wilcoxon. Pengetahuan kesehatan tentang Batuan hidup dasar (BHD) pada anggota PMR sebelum pendidikan kesehatan memiliki nilai rata-rata 71,22, sesudah pendidikan kesehatan memiliki nilai rata-rata 87,78. Ada pengaruh pendidikan kesehatan tentang Batuan hidup dasar (BHD) terhadap tingkat pengetahuan anggota PMR diperoleh nilai p-value 0,0001>0,05. Ada pengaruh pendidikan kesehatan tentang Batuan hidup dasar (BHD) terhadap tingkat pengetahuan anggota PMR. Hasil penelitian ini memberikan masukan pada SMK N 1 Bawen agar dapat mengadakan pelatihan tentang penanganan Batuan hidup dasar (BHD) pada anggota PMR.",0.35
Marketing 4.0 dalam Pelayanan Kesehatan: Tinjauan Literatur terhadap Transformasi Digital dan Strategi Pemasaran: Literature Review,"Industri pelayanan kesehatan sedang mengalami transisi mendasar sebagai akibat dari kemajuan teknologi digital, termasuk inovasi dalam pemasaran digital. Marketing 4.0 yang berfokus pada penggunaan teknologi digital dan interaksi online menjadi pendorong utama perubahan dalam bisnis ini. Tujuan: Dalam perspektif ini, penelitian ini mengkaji penggunaan pemasaran digital dalam layanan kesehatan. Metode: Metode penelitian ini menggunakan literature review dengan mengacu pada sumber-sumber dalam bahasa Inggris dan bahasa Indonesia melalui database seperti Pubmed, ProQuest, Scopus, dan Google Scholar. Kriteria inklusi mencakup artikel yang membahas pemasaran digital dalam layanan kesehatan. Hasil: Hasil dari penelusuran artikel melibatkan tiga penelitian yang relevan. Studi-studi ini mengungkapkan pentingnya integrasi berbagai saluran komunikasi pemasaran online, termasuk periklanan, hubungan masyarakat, penjualan pribadi, promosi penjualan, penjualan langsung, dan pemasaran digital, untuk mengembangkan strategi komunikasi layanan kesehatan yang efektif dan efisien. Selain itu, penelitian menyoroti dampak positif pemasaran media sosial terhadap layanan kesehatan dan keterlibatan merek, serta strategi pemasaran digital yang efisien seperti penggunaan media sosial, optimalisasi pencarian digital, dan periklanan online. Kesimpulan: Marketing 4.0 telah mengubah lanskap pemasaran dalam industri layanan kesehatan. Pemasaran digital menjadi alat yang krusial dalam berinteraksi dengan pasien, mempromosikan layanan kesehatan, dan membangun merek yang kuat. Transformasi digital dan strategi pemasaran yang terintegrasi menjadi kunci untuk memenuhi harapan pasien dan meningkatkan pengalaman mereka dalam pelayanan kesehatan.",DAMPAK PERNIKAHAN USIA DINI TERHADAP KESEHATAN REPRODUKSI,"Pernikahan merupakan ikatan lahir dan batin berupa penyatuan antara laki-laki dan perempuan atas dasar keinginan untuk memiliki keturunan dan keluarga. Pada dasarnya pernikahan dilakukan oleh seseorang yang telah memiliki kematangan dalam segi fisik, psikologis, dan ekonomi. Namun, di Indonesia sekitar 12 - 20% masih bisa ditemukan pernikahan yang belum disertai dengan kesiapan dari berbagai aspek seperti fisik, ekonomi, dan pengetahuan mengenai kehidupan rumah tangga. Artikel ini menggunakan metode penelitian kualitatif dan deskriptif yang akan menggali lebih dalam mengenai pernikahan dini dan keterkaitannya dengan kesehatan reproduksi. Pernikahan usia dini dilakukan oleh seseorang yang rata-rata berusia dibawah 19 tahun yang rata-rata belum siap dalam berbagai aspek dalam pernikahan. Hal ini kemungkinan akan berdampak terhadap kesehatan reproduksi baik untuk perempuan maupun laki-laki. Oleh karena itu, diperlukan persiapan yang dari berbagai aspek dalam melaksanakan pernikahan sehingga upaya untuk menghindari dampak buruk pernikahan usia dini terhadap kesehatan reproduksi dapat diminimalisir.",0.15
Pemanfaatan Teknologi Informasi dalam Pembelajaran Tingkat Sekolah Dasar pada Masa Pandemi Covid-19,"Penelitian ini dilakukan untuk mengetahui manfaat dari teknologi informasi dalam proses pembelajaran di sekolah dasar pada masa pandemikCOVID-19. Dengan menggunakan metode penelitian kepustakaan. Pandemik COVID-19 sangat berdampak pada pendidikan di Indoneia. Proses pembelajaran yang awalnya dilakukan di sekolah kini menjadi pembelajaran daring yang dilakukan dari rumah. Pemanfaatan teknologi informasi sangat membantu dalam proses pembelajaran di masa Pandemi COVID-19. Kemajuan teknologi informasi yang  sudah sangat maju saat ini, internet bisa menghubungkan siswa dengan guru melalui laman e-learning, whatsapp group, google class,google doc atau google form, zoom.  Kemendikbud juga menyediakan platform belajar daring gratis bernama Rumah Belajar. Untuk daerah di mana koneksi internetnya tidak terlalu baik, pemerintah bekerja sama dengan TVRI, stasiun televisi negara, untuk menyampaikan materi belajar yang ada di dalam program Belajar di Rumah.Pada tingkat sekolah dasar kelas atas aplikasi yang yang efektif digunakan dalam proses pembelajaran online adalah aplikasi google classroom dan aplikasi zoom sedangkan untuk kelas bawah aplikasi yang dapat sangat efektif digunakan adalah aplikasi whatshapp group. Dalam proses pembelajaran daring yang dilakukan siswa tidak lepas dari pengawasan orang tua dan guru.",kesehatan,"HIV-AIDS adalah penyakit infeksi yang disebabkan oleh infeksi Human Immunodeficiency Virus. HIV dapat ditularkan melalui seks, transfusi darah, berbagi jarum suntik dan penularan ibu-ke-bayi (perinatal). Faktor risiko heteroseksual adalah yang tertinggi, yaitu 82,8%, diikuti oleh homoseksual sebesar 7,4% dan perinatal sebesar 4,0%",0.05
PENGERTIAN NARKOBA DAN BAHAYA NARKOBA BAGI KESEHATAN,"Masa Remaja merupakan masa dimana seseorang mengalami peralihan dari satu tahap ke tahap berikutnya dan mengalami perubahan baik emosi, tubuh, pola perilaku, pola pikir dan jugapenuh dengan masalah-masalah remaja.Terkadang mengonsumsi narkoba menjadi salah satu jalan tenang bagi seorang remaja.Kebiasaan mengonsumsi narkoba bagi para remaja bermula karena kurangnya pengetahuan, terlalu stress, dan bisa juga terbujuk dengan rayuan temannya. Jika sudah mengonsumsi narkoba,sebaiknya dengan cepat menghindari nya sebelum kecanduan. Mulai dari hidup sehat dan teratur mengingat bahaya narkoba bagi kesehatan yang sangat mengerikan. Carilah suasana pergaulan baru yang menjauhi Perilaku mengonsumsi Narkoba.",Pengembangan E-Modul Berbasis Flipbook Maker pada Mata Pelajaran Teknologi Perkantoran,"Tujuan dari penelitian ini pengembangan e-modul berbasis flipbook maker pada mata pelajaran teknologi perkantoran ini yaitu 1)untuk mengetahui proses pengembangan e-modul berbasis flipbook maker pada mata pelajaran teknologi perkantoran; 2)kelayakan pengembangan e-modul berbasis flipbook maker pada mata pelajaran teknologi perkantoran; 3)respons siswa terhadap pengembangan e-modul berbasis flipbook maker pada mata pelajaran teknologi perkantoran. Jenis metode penelitian ini adalah Research And Development dengan menggunakan model ADDIE yang terdapat lima tahapan yaitu Analysis (analisis data), Design (perencanaan), Development (pengembangan), Implementation (penerapan), Evaluation (evaluasi). Dalam penelitian ini instrumen yang digunakan yaitu terdiri dari lembar validasi ahli materi, media, bahasa dan hasil angket respons siswa SMKN 1 Sooko Mojokerto. Hal tersebut dibuktikan dengan hasil dari validasi ahli materi memperoleh persentase sebesar 85%, ahli media sebesar 92%, ahli bahasa sebesar 88% pengembangan e-modul berbasis flipbook maker pada mata pelajaran teknologi perkantoran memperoleh kategori sangat layak secara keseluruhan persentase yang diperoleh 88,33% dan hasil angket respons siswa memperoleh persentase 95,45%. Sehingga dapat disimpulkan bahwa pengembangan e-modul berbasis flipbook maker pada mata pelajaran teknologi perkantoran sangat layak untuk diterapkan di SMKN 1 Sooko Mojokerto",0.05
Skrining Kesehatan Anak Sekolah sebagai upaya deteksi Kesehatan sejak dini,"Kesehatan anak merupakan hal yang penting, mengingat anak merupakan generasi penerus bangsa yang meneruskan pembanguanan bangsa ke arah yang lebih baik . dalam bidang kesehatan saat ini, masaah kesehatan anak merupakan masalah yang utama. Penyelenggaraan upaya kesehatan mempunyai tujuan untuk mencapai kemampuan hidup sehat bagi setiap manusia. Penjaringan Kesehatan Anak Sekolah (Screening) merupakan salah satu bentuk dari pelayanan kesehatan yang bertujuan untuk mendeteksi dini siswa yang memiliki masalah kesehatan agar segera mendapatkan penanganan sedini mungkin serta tersedianya data atau informasi untuk menilai perkembangan kesehatan peserta didik. Meliputi Pemeriksaan kebersihan perorangan (rambut, kulit dan kuku) pemeriksaan status gizi melalui pengukuran antropometri, pemeriksaan ketajaman indera (penglihatan dan pendengaran), pemeriksaan kesehatan gigi dan mulut. Setelah selesai pemeriksaan siswa diberikan penyuluhan tentang UKGS (Usaha Kesehatan Gigi Anak Sekolah). Kegiatan yang dilakukan unuk meningkatkan kewaspadaan terhadap masalah kesehatan anak sekolah dasar maka dilaksanakan screening atau penjaringan kesehatan anak sekolah dasar. Kegiatan dilaksanakan dalam waktu selama 4 hari yaitu tanggal 4,5,6 dan 7 Februari 2022 pada murid kelas 1- 6 di SD Blabak II dan IV Kabupaten Kediri. Kegiatan dilaksanan dengan metode pemeriksaan klinis berupa anamnesa dan pemeriksaan dengan mengukur tinggi badan menggunakan pengukur tinggi badan. Mengukur berat badan degan timbangan, kemudian melakukan pemeriksaan dari kebersihan rambut, mata, hidung, gigi, dan mulut, telinga dengan menggunakan penlight kemudian memeriksa kebersihan kulit dan kuku.","Transformasi Jaringan Telekomunikasi dengan Teknologi 5G: Tantangan, Potensi, dan Implikasi","Teknologi 5G telah menjadi fokus utama dalam transformasi jaringan telekomunikasi saat ini. Artikel ini mengulas tantangan, potensi, dan implikasi yang terkait dengan penerapan teknologi 5G. Tantangan yang dihadapi meliputi infrastruktur yang kompleks, pengelolaan frekuensi yang efisien, dan keamanan yang lebih tinggi. Namun, teknologi 5G juga memiliki potensi besar dalam meningkatkan kecepatan dan kapasitas jaringan, memfasilitasi konektivitas yang lebih baik, dan mengakselerasi perkembangan teknologi lainnya. Implikasi dari teknologi 5G mencakup perubahan sosial, transformasi industri, dan kebijakan regulasi yang harus disesuaikan. Penelitian lanjutan dan kerjasama yang erat antara pemangku kepentingan akan sangat diperlukan untuk mengatasi tantangan dan memaksimalkan potensi teknologi 5G.",0.05
STRATEGI PENDIDIKAN UNTUK SUKSES DI ERA TEKNOLOGI 5.0,"Teknologi 5.0 adalah evolusi terbaru dari teknologi, yang menghubungkan dunia fisik dan digital dengan lebih integratif dan efektif dari definisinya hingga penerapannya dalam berbagai sektor, seperti manufaktur, pertanian, kesehatan, dan pendidikan. Di era teknologi 5.0, teknologi semakin mengoptimalkan kehidupan manusia dengan mempercepat proses produksi dan memberikan solusi yang lebih efisien dan akurat. Namun, pengembangan teknologi juga memunculkan tantangan, seperti penggunaan teknologi yang tidak bertanggung jawab dan pelanggaran privasi. Era Teknologi 5.0 menjadi sebuah fenomena baru dalam pengembangan teknologi di berbagai bidang, termasuk dalam bidang pendidikan. Perubahan ini mempengaruhi pendidikan untuk dapat mengembangkan kompetensi dan keterampilan abad ke-21. Artikel ini mengulas mengenai perkembangan pendidikan di era Teknologi 5.0, serta tantangan dan peluang yang terkait dengan penggunaan teknologi dalam pendidikan. Dalam era ini, kurikulum dan metode pembelajaran berbasis teknologi harus dikembangkan agar dapat memenuhi kebutuhan perkembangan zaman. Guru juga harus dilatih agar memiliki kemampuan dalam mengoperasikan teknologi yang semakin canggih, serta memanfaatkan peluang untuk menciptakan pembelajaran yang lebih inklusif dan berbasis keterampilan. Pendidikan di era Teknologi 5.0 memberikan peluang untuk memperkuat relevansi pendidikan dengan kebutuhan zaman.",DAMPAK TEKNOLOGI TERHADAP PENDIDIKAN,"Teknologi pembelajaran terus mengalami perkembangan seiring dengan perkembangan zaman. Dalam pelaksanaan pembelajaran sehari-hari kita sering jumpai adanya pemfaatan dari perkembangan Teknologi dalam dunia pendidikan, seperti yang sering dilakukan oleh guru atau dosen yaitu mengkombinasikan alat teknologi dalam peroses pembelajaran. Namun demikian, teknologi itu tidak hanya mendatangkan manfaat positif, melainkan juga akan dapat mendatangkan dampak negatif, perkembangan ilmu pengetahuan dan teknologi berdampak positif dengan semakin terbuka dan tersebarnya informasi dan pengetahuan dari dan ke seluruh dunia menembus batas ruang dan waktu. Dampak negatifnya yaitu terjadinya perubahan perilaku, etika, norma, aturan, atau moral kehidupan yang bertentangan dengan etika, norma, aturan, dan moral kehidupan yang ada pada masyarakat.",0.45
Kebijakan Akselerasi Transformasi Digital di Indonesia: Peluang dan Tantangan untuk Pengembangan Ekonomi Kreatif,"Transformasi digital telah menjadi tren global yang mempengaruhi semua aspek kehidupan manusia. Di Indonesia, kebijakan akselerasi transformasi digital dapat mempercepat pertumbuhan ekonomi, terutama di sektor ekonomi kreatif. Permasalahan yang ada di antaranya terkait dengan infrastruktur, literasi dan regulasi dalam mengakselerasi transformasi yang ada. Tujuan dari penelitian ini adalah untuk menganalisis peluang dan tantangan yang terkait dengan kebijakan akselerasi transformasi digital dalam pengembangan ekonomi kreatif di Indonesia. Penelitian menemukan bahwa ada berbagai peluang yang dapat dimanfaatkan dalam pengembangan ekonomi kreatif di Indonesia melalui kebijakan akselerasi transformasi digital, tantangan yang harus diatasi, seperti rendahnya aksesibilitas teknologi dan infrastruktur yang kurang memadai. Penelitian menunjukkan bahwa kebijakan akselerasi transformasi digital dapat menjadi pendorong pertumbuhan ekonomi kreatif di Indonesia yang harus disesuaikan dengan kondisi lokal dan diiringi dengan upaya-upaya untuk meningkatkan aksesibilitas teknologi dan infrastruktur yang memadai. Metode penelitian yang digunakan dalam studi ini adalah pendekatan kualitatif untuk memahami dan menjelaskan fenomena yang kompleks dan bervariasi dari sudut pandang subjek yang terlibat dalam studi ini. Analisis data dilakukan dengan menggunakan studi literatur dari jurnal ilmiah popular dan data statistik yang dapat dipertanggungjawabkan. Analisis data dilakukan melalui pengumpulan data dari berbagai sumber literatur yang relevan dengan fenomena yang akan diteliti. Berdasarkan hasil penelitian, dapat disimpulkan bahwa kebijakan akselerasi transformasi digital dapat menjadi faktor penting dalam pengembangan ekonomi kreatif di Indonesia dengan upaya-upaya untuk mengatasi tantangan yang ada, seperti meningkatkan aksesibilitas teknologi dan infrastruktur yang memadai. Oleh karena itu, diperlukan sinergi antara pelaku industri, pemerintah, dan masyarakat dalam mendorong dan mendukung pertumbuhan ekonomi kreatif melalui kebijakan akselerasi transformasi digital.",Implementasi Teknologi dalam Pembelajaran di Era Digital: Tantangan dan Peluang bagi Dunia Pendidikan di Indonesia,"Penelitian ini mengeksplorasi tantangan dan peluang yang terkait dengan implementasi teknologi dalam pembelajaran dalam konteks era digital di Indonesia. Dengan menggunakan pendekatan metode campuran, penelitian ini menggabungkan data kualitatif dan kuantitatif dari para pendidik, pembuat kebijakan, siswa, dan orang tua untuk mendapatkan wawasan yang komprehensif. Temuan-temuannya mengungkapkan kondisi integrasi teknologi saat ini, menyoroti kesenjangan dalam akses dan infrastruktur teknologi. Mengatasi kesenjangan digital dan menyediakan pengembangan profesional yang sesuai untuk para pendidik diidentifikasi sebagai langkah penting untuk membuka potensi penuh dari teknologi untuk meningkatkan pendidikan di Indonesia. Pelokalan konten digital dan penciptaan lingkungan belajar yang inklusif dan berbasis teknologi merupakan hal yang sangat penting untuk mempersiapkan siswa menghadapi masa depan yang semakin berpusat pada teknologi.",0.5
