title1,abstract1,title2,abstract2,pseudo-label
A conceptual framework for action on the social determinants of health.,"When he announced his intention to create the Commission on Social Determinants of Health (CSDH), WHO Director-General Lee Jong-wook identified the Commission as part of a comprehensive effort to promote greater equity in global health, in a spirit of social justice1. The Commission's goal, then, is to advance health equity, driving action to reduce health differences among social groups, within and between countries. Getting to grips with this mission requires finding answers to three fundamental problems: 1. Where do health differences among social groups originate, if we trace them back to their deepest roots? 2. What pathways lead from root causes to the stark differences in health status observed at the population level? 3. In light of the answers to the first two questions, where and how should we intervene to reduce health inequities? This paper seeks to make explicit a shared understanding of these issues that can orient the work of the CSDH.",The outbreak of COVID-19 coronavirus and its impact on global mental health,"Background: The current outbreak of COVID-19 coronavirus infection among humans in Wuhan (China) and its spreading around the globe is heavily impacting on the global health and mental health. Despite all resources employed to counteract the spreading of the virus, additional global strategies are needed to handle the related mental health issues. Methods: Published articles concerning mental health related to the COVID-19 outbreak and other previous global infections have been considered and reviewed. Comments: This outbreak is leading to additional health problems such as stress, anxiety, depressive symptoms, insomnia, denial, anger and fear globally. Collective concerns influence daily behaviors, economy, prevention strategies and decision-making from policy makers, health organizations and medical centers, which can weaken strategies of COVID-19 control and lead to more morbidity and mental health needs at global level.",0.39227044582366943
The Relationship Between Education and Health: Reducing Disparities Through a Contextual Approach.,"Adults with higher educational attainment live healthier and longer lives compared with their less educated peers. The disparities are large and widening. We posit that understanding the educational and macrolevel contexts in which this association occurs is key to reducing health disparities and improving population health. In this article, we briefly review and critically assess the current state of research on the relationship between education and health in the United States. We then outline three directions for further research: We extend the conceptualization of education beyond attainment and demonstrate the centrality of the schooling process to health; we highlight the dual role of education as a driver of opportunity but also as a reproducer of inequality; and we explain the central role of specific historical sociopolitical contexts in which the education-health association is embedded. Findings from this research agenda can inform policies and effective interventions to reduce health disparities and improve health for all Americans.","Associations of health literacy with socioeconomic position, health risk behavior, and health status: a large national population-based survey among Danish adults","Background Health literacy concerns the ability of citizens to meet the complex demands of health in modern society. Data on the distribution of health literacy in general populations and how health literacy impacts health behavior and general health remains scarce. The present study aims to investigate the prevalence of health literacy levels and associations of health literacy with socioeconomic position, health risk behavior, and health status at a population level. Methods A nationwide cross-sectional survey linked to administrative registry data was applied to a randomly selected sample of 15,728 Danish individuals aged ≥25 years. By the short form HLS-EU-Q16 health literacy was measured for the domains of healthcare, disease prevention, and health promotion. Adjusted multinomial logistic regression analyses were used to estimate associations of health literacy with demographic and socioeconomic characteristics, health risk behavior (physical activity, smoking, alcohol consumption, body weight), and health status (sickness benefits, self-assessed health). Results Overall, 9007 (57.3%) individuals responded to the survey. Nearly 4 in 10 respondents faced difficulties in accessing, understanding, appraising, and applying health information. Notably, 8.18% presented with inadequate health literacy and 30.94% with problematic health literacy. Adjusted for potential confounders, regression analyses showed that males, younger individuals, immigrants, individuals with basic education or income below the national average, and individuals receiving social benefits had substantially higher odds of inadequate health literacy. Among health behavior factors (smoking, high alcohol consumption, and inactivity), only physical behavior [sedentary: OR: 2.31 (95% CI: 1.81; 2.95)] was associated with inadequate health literacy in the adjusted models. The long-term health risk indicator body-weight showed that individuals with obesity [OR: 1.78 (95% CI: 1.39; 2.28)] had significantly higher odds of lower health literacy scores. Poor self-assessed health [OR: 4.03 (95% CI: 3.26; 5.00)] and payments of sickness absence compensation benefits [OR: 1.74 (95% CI: 1.35; 2.23)] were associated with lower health literacy scores. Conclusions Despite a relatively highly educated population, the prevalence of inadequate health literacy is high. Inadequate health literacy is strongly associated with a low socioeconomic position, poor health status, inactivity, and overweight, but to a lesser extent with health behavior factors such as smoking and high alcohol consumption.",0.5660121440887451
On the Economy of the Human Processing System: A Model of Multiple Capacity.,"Abstract : An approach to human performance which is based on economic concepts is proposed. This approach hinges on the idea that the human processing system has a number of mechanisms each having its own capacity. Those capacities can at any moment be allocated among several processes. Since tasks may differ with respect to the types of mechanisms they call for and the demands they pose for the use of those mechanisms, it is argued that the hope to find single measures for system capacity and mental load may be groundless. Different pairs of time-shared tasks may conflict with each other to a variable degree, which is difficult to predict without knowing the overlap in their demand for various mechanisms. The amount and specific nature of trade-off between time-shared tasks can be displayed by means of performance operating characteristics. The effects of a number of properties of the system and of the tasks on the shape and interpretation of performance operating characteristics are discussed. The analysis in this paper also serves to elucidate the notion of resources brought forward by previous authors, to elaborate on the distinction between demand for and supply of resources, to discuss possible interactions between the effects of supply of resources and situation parameters on performance, and to conjecture about the way by which allocation policy depends on the value of outcomes of different allocations.",Prioritizing the Mental Health and Well-Being of Healthcare Workers: An Urgent Global Public Health Priority,"The COVID-19 pandemic has had an unprecedented impact on health systems in most countries, and in particular, on the mental health and well-being of health workers on the frontlines of pandemic response efforts. The purpose of this article is to provide an evidence-based overview of the adverse mental health impacts on healthcare workers during times of crisis and other challenging working conditions and to highlight the importance of prioritizing and protecting the mental health and well-being of the healthcare workforce, particularly in the context of the COVID-19 pandemic. First, we provide a broad overview of the elevated risk of stress, burnout, moral injury, depression, trauma, and other mental health challenges among healthcare workers. Second, we consider how public health emergencies exacerbate these concerns, as reflected in emerging research on the negative mental health impacts of the COVID-19 pandemic on healthcare workers. Further, we consider potential approaches for overcoming these threats to mental health by exploring the value of practicing self-care strategies, and implementing evidence based interventions and organizational measures to help protect and support the mental health and well-being of the healthcare workforce. Lastly, we highlight systemic changes to empower healthcare workers and protect their mental health and well-being in the long run, and propose policy recommendations to guide healthcare leaders and health systems in this endeavor. This paper acknowledges the stressors, burdens, and psychological needs of the healthcare workforce across health systems and disciplines, and calls for renewed efforts to mitigate these challenges among those working on the frontlines during public health emergencies such as the COVID-19 pandemic.",0.240585595369339
"Understanding associations among race, socioeconomic status, and health: Patterns and prospects.","Race/ethnicity and socioeconomic status (SES) are social categories that capture differential exposure to conditions of life that have health consequences. Race/ethnicity and SES are linked to each other, but race matters for health even after SES is considered. This commentary considers the complex ways in which race combines with SES to affect health. There is a need for greater attention to understanding how risks and resources in the social environment are systematically patterned by race, ethnicity and SES, and how they combine to influence cardiovascular disease and other health outcomes. Future research needs to examine how the levels, timing and accumulation of institutional and interpersonal racism combine with other toxic exposures, over the life-course, to influence the onset and course of illness. There is also an urgent need for research that seeks to build the science base that will identify the multilevel interventions that are likely to enhance the health of all, even while they improve the health of disadvantaged groups more rapidly than the rest of the population so that inequities in health can be reduced and ultimately eliminated. We also need sustained research attention to identifying how to build the political support to reduce the large shortfalls in health. (PsycINFO Database Record",Review: Information Technology and Organizational Performance: An Integrative Model of IT Business Value,"Despite the importance to researchers, managers, and policy makers of how information technology (IT) contributes to organizational performance, there is uncertainty and debate about what we know and don't know. A review of the literature reveals that studies examining the association between information technology and organizational performance are divergent in how they conceptualize key constructs and their interrelationships. We develop a model of IT business value based on the resource-based view of the firm that integrates the various strands of research into a single framework. We apply the integrative model to synthesize what is known about IT business value and guide future research by developing propositions and suggesting a research agenda. A principal finding is that IT is valuable, but the extent and dimensions are dependent upon internal and external factors, including complementary organizational resources of the firm and its trading partners, as well as the competitive and macro environment. Our analysis provides a blueprint to guide future research and facilitate knowledge accumulation and creation concerning the organizational performance impacts of information technology.",-0.021087046712636948
The Sustainability of Evidence-Based Interventions and Practices in Public Health and Health Care.,"There is strong interest in implementation science to address the gap between research and practice in public health. Research on the sustainability of evidence-based interventions has been growing rapidly. Sustainability has been defined as the continued use of program components at sufficient intensity for the sustained achievement of desirable program goals and population outcomes. This understudied area has been identified as one of the most significant translational research problems. Adding to this challenge is uncertainty regarding the extent to which intervention adaptation and evolution are necessary to address the needs of populations that differ from those in which interventions were originally tested or implemented. This review critically examines and discusses conceptual and methodological issues in studying sustainability, summarizes the multilevel factors that have been found to influence the sustainability of interventions in a range of public health and health care settings, and highlights key areas for future research.",Governing the economy : the politics of state intervention in Britain and France,"For over one hundred years, the British economy has been in decline relative to other industrialized countries. This book explores the origins of Britain's economic problems and develops a striking new argument about the sources of decline. It goes on to analyze the evolution of economic policy in postwar Britain from the development of Keynesianism to the rise of monetarism under Margaret Thatcher. France, by contrast, experienced an economic miracle in the postwar period. Hall argues that the French state transformed itself and then its society through an extensive system of state intervention. In the recent period, however, the French system has encountered many difficulties, and the book locates their sources in the complex interaction between state and society in France culminating in the socialist experiment of Francois Mitterrand. Through his insightful, comparative examination of policy-making in Britain and France, Hall develops a new approach to state-society relations that emphasizes the crucial role of institutional structures.",0.05588477849960327
"Mobile medical and health apps: state of the art, concerns, regulatory control and certification","This paper examines the state of the art in mobile clinical and health-related apps. A 2012 estimate puts the number of health-related apps at no fewer than 40,000, as healthcare professionals and consumers continue to express concerns about the quality of many apps, calling for some form of app regulatory control or certification to be put in place. We describe the range of apps on offer as of 2013, and then present a brief survey of evaluation studies of medical and health-related apps that have been conducted to date, covering a range of clinical disciplines and topics. Our survey includes studies that highlighted risks, negative issues and worrying deficiencies in existing apps. We discuss the concept of 'apps as a medical device' and the relevant regulatory controls that apply in USA and Europe, offering examples of apps that have been formally approved using these mechanisms. We describe the online Health Apps Library run by the National Health Service in England and the calls for a vetted medical and health app store. We discuss the ingredients for successful apps beyond the rather narrow definition of 'apps as a medical device'. These ingredients cover app content quality, usability, the need to match apps to consumers' general and health literacy levels, device connectivity standards (for apps that connect to glucometers, blood pressure monitors, etc.), as well as app security and user privacy. 'Happtique Health App Certification Program' (HACP), a voluntary app certification scheme, successfully captures most of these desiderata, but is solely focused on apps targeting the US market. HACP, while very welcome, is in ways reminiscent of the early days of the Web, when many ""similar"" quality benchmarking tools and codes of conduct for information publishers were proposed to appraise and rate online medical and health information. It is probably impossible to rate and police every app on offer today, much like in those early days of the Web, when people quickly realised the same regarding informational Web pages. The best first line of defence was, is, and will always be to educate consumers regarding the potentially harmful content of (some) apps.",The prescription opioid and heroin crisis: a public health approach to an epidemic of addiction.,"Public health authorities have described, with growing alarm, an unprecedented increase in morbidity and mortality associated with use of opioid pain relievers (OPRs). Efforts to address the opioid crisis have focused mainly on reducing nonmedical OPR use. Too often overlooked, however, is the need for preventing and treating opioid addiction, which occurs in both medical and nonmedical OPR users. Overprescribing of OPRs has led to a sharp increase in the prevalence of opioid addiction, which in turn has been associated with a rise in overdose deaths and heroin use. A multifaceted public health approach that utilizes primary, secondary, and tertiary opioid addiction prevention strategies is required to effectively reduce opioid-related morbidity and mortality. We describe the scope of this public health crisis, its historical context, contributing factors, and lines of evidence indicating the role of addiction in exacerbating morbidity and mortality, and we provide a framework for interventions to address the epidemic of opioid addiction.",0.2453276365995407
Governance in the Blockchain Economy: A Framework and Research Agenda,"Blockchain technology is often referred to as a groundbreaking innovation and the harbinger of a new economic era. Blockchains may be capable of engendering a new type of economic system: the blockchain economy. In the blockchain economy, agreed-upon transactions would be enforced autonomously, following rules defined by smart contracts. The blockchain economy would manifest itself in a new form of organizational design-decentralized autonomous organizations (DAO)-which are organizations with governance rules specified in the blockchain. We discuss the blockchain economy along dimensions defined in the IT governance literature: decision rights, accountability, and incentives. Our case study of a DAO illustrates that governance in the blockchain economy may depart radically from established notions of governance. Using the three governance dimensions, we propose a novel IT governance framework and a research agenda for governance in the blockchain economy. We challenge common assumptions in the blockchain discourse, and propose promising information systems research related to these assumptions.",Managerial Ties and Firm Performance in a Transition Economy: The Nature of a Micro-Macro Link,"Using survey data from China, we demonstrate that managers' micro interpersonal ties with top executives at other firms and with government officials help improve macro organizational performance. This micro-macro link differs among firms with different (1) ownership types, (2) business sectors, (3) sizes, and (4) industry growth rates. In addition, managerial ties were found to be necessary but insufficient for good performance; a number of traditional strategy variables also drive performance. Theoretically, the findings point to the importance of the social context in which managerial ties are embedded. Empirically, this study provides the first set of quantitative data demonstrating both the extent and limits to which managerial ties are beneficial in a transition economy.",0.16661038994789124
"Social isolation, loneliness and health in old age: a scoping review","The health and well-being consequences of social isolation and loneliness in old age are increasingly being recognised. The purpose of this scoping review was to take stock of the available evidence and to highlight gaps and areas for future research. We searched nine databases for empirical papers investigating the impact of social isolation and/or loneliness on a range of health outcomes in old age. Our search, conducted between July and September 2013 yielded 11,736 articles, of which 128 items from 15 countries were included in the scoping review. Papers were reviewed, with a focus on the definitions and measurements of the two concepts, associations and causal mechanisms, differences across population groups and interventions. The evidence is largely US-focused, and loneliness is more researched than social isolation. A recent trend is the investigation of the comparative effects of social isolation and loneliness. Depression and cardiovascular health are the most often researched outcomes, followed by well-being. Almost all (but two) studies found a detrimental effect of isolation or loneliness on health. However, causal links and mechanisms are difficult to demonstrate, and further investigation is warranted. We found a paucity of research focusing on at-risk sub-groups and in the area of interventions. Future research should aim to better link the evidence on the risk factors for loneliness and social isolation and the evidence on their impact on health.",The GRADE Evidence to Decision (EtD) framework for health system and public health decisions,"ObjectiveTo describe a framework for people making and using evidence-informed health system and public health recommendations and decisions.BackgroundWe developed the GRADE Evidence to Decision (EtD) framework for health system and public health decisions as part of the DECIDE project, in which we simultaneously developed frameworks for these and other types of healthcare decisions, including clinical recommendations, coverage decisions and decisions about diagnostic tests.Developing the frameworkBuilding on GRADE EtD tables, we used an iterative approach, including brainstorming, consultation of the literature and with stakeholders, and an international survey of policy-makers. We applied the framework to diverse examples, conducted workshops and user testing with health system and public health guideline developers and policy-makers, and observed and tested its use in real-life guideline panels.FindingsAll the GRADE EtD frameworks share the same basic structure, including sections for formulating the question, making an assessment and drawing conclusions. Criteria listed in the assessment section of the health system and public health framework cover the important factors for making these types of decisions; in addition to the effects and economic impact of an option, the priority of the problem, the impact of the option on equity, and its acceptability and feasibility are important considerations that can inform both whether and how to implement an option. Because health system and public health interventions are often complex, detailed implementation considerations should be made when making a decision. The certainty of the evidence is often low or very low, but decision-makers must still act. Monitoring and evaluation are therefore often important considerations for these types of decisions.We illustrate the different components of the EtD framework for health system and public health decisions by presenting their application in a framework adapted from a real-life guideline.DiscussionThis framework provides a structured and transparent approach to support policy-making informed by the best available research evidence, while making the basis for decisions accessible to those whom they will affect. The health system and public health EtD framework can also be used to facilitate dissemination of recommendations and enable decision-makers to adopt, and adapt, recommendations or decisions.",0.1395988017320633
