title1,abstract1,title2,abstract2,pseudo-label
"Digital Economy, Technological Innovation and High-Quality Economic Development: Based on Spatial Effect and Mediation Effect","Technological innovation and high-quality economic development are inevitable requirements of sustainable development, and the digital economy has gradually become a new engine to enhance technological innovation and the high-quality development of China's economy. Deeply discussing the effect of digital economy on high-quality economic development and clarifying the mechanism behind it can effectively grant the boosting power of digital economy to China's high-quality development, which is of great practical significance to China's sustainable economic development. In this study, the mechanism, effect, and regional heterogeneity of the impact of the digital economy on the level of high-quality economic development in 30 Chinese provinces from 2011-2019 were measured and empirically tested using a mediating effects model and a spatial Durbin model, among others. The results showed that the overall level of digital economy and high-quality development is not high, and there were both high agglomeration and low agglomeration, with obvious spatial path dependence and spatial lock-in. Digital economy could promote the high-quality development level of the economy, and the spatial spillover effect was remarkable. In addition, the function of digital economy in promoting high-quality economic development in the eastern, central, and western regions was gradually weakened. Besides, the technological innovation was an important transmission path of digital economy to high-quality economic development. Based on these findings, it is proposed that decision-makers should strengthen digitalization efforts so that the digital economy can become a powerful tool to narrow the digital divide. Further, the dynamic and differentiated digital economy development strategy should be implemented to reduce regional development imbalances in an effective manner.",Mobile text messaging for health: a systematic review of reviews.,"The aim of this systematic review of reviews is to identify mobile text-messaging interventions designed for health improvement and behavior change and to derive recommendations for practice. We have compiled and reviewed existing systematic research reviews and meta-analyses to organize and summarize the text-messaging intervention evidence base, identify best-practice recommendations based on findings from multiple reviews, and explore implications for future research. Our review found that the majority of published text-messaging interventions were effective when addressing diabetes self-management, weight loss, physical activity, smoking cessation, and medication adherence for antiretroviral therapy. However, we found limited evidence across the population of studies and reviews to inform recommended intervention characteristics. Although strong evidence supports the value of integrating text-messaging interventions into public health practice, additional research is needed to establish longer-term intervention effects, identify recommended intervention characteristics, and explore issues of cost-effectiveness.",0.08242808282375336
The Gifts Of Athena Historical Origins Of The Knowledge Economy,"Thank you for reading the gifts of athena historical origins of the knowledge economy. As you may know, people have look hundreds times for their favorite readings like this the gifts of athena historical origins of the knowledge economy, but end up in infectious downloads. Rather than enjoying a good book with a cup of tea in the afternoon, instead they juggled with some harmful virus inside their laptop.",Unequal treatment: confronting racial and ethnic disparities in health care.,"Racial and ethnic disparities in health care are known to reflect access to care and other issues that arise from differing socioeconomic conditions. There is, however, increasing evidence that even after such differences are accounted for, race and ethnicity remain significant predictors of the quality of health care received. In Unequal Treatment, a panel of experts documents this evidence and explores how persons of color experience the health care environment. The book examines how disparities in treatment may arise in health care systems and looks at aspects of the clinical encounter that may contribute to such disparities. Patients' and providers' attitudes, expectations, and behavior are analyzed. How to intervene? Unequal Treatment offers recommendations for improvements in medical care financing, allocation of care, availability of language translation, community-based care, and other arenas. The committee highlights the potential of cross-cultural education to improve provider-patient communication and offers a detailed look at how to integrate cross-cultural learning within the health professions. The book concludes with recommendations for data collection and research initiatives. Unequal Treatment will be vitally important to health care policymakers, administrators, providers, educators, and students as well as advocates for people of color.",-0.0371033176779747
Designing the Business Models for Circular Economy-Towards the Conceptual Framework,"Switching from the current linear model of economy to a circular one has recently attracted increased attention from major global companies e.g., Google, Unilever, Renault, and policymakers attending the World Economic Forum. The reasons for this are the huge financial, social and environmental benefits. However, the global shift from one model of economy to another also concerns smaller companies on a micro-level. Thus, comprehensive knowledge on designing circular business models is needed to stimulate and foster implementation of the circular economy. Existing business models for the circular economy have limited transferability and there is no comprehensive framework supporting every kind of company in designing a circular business model. This study employs a literature review to identify and classify the circular economy characteristics according to a business model structure. The investigation in the eight sub-domains of research on circular business models was used to redefine the components of the business model canvas in the context of the circular economy. Two new components-the take-back system and adoption factors-have been identified, thereby leading to the conceptualization of an extended framework for the circular business model canvas. Additionally, the triple fit challenge has been recognized as an enabler of the transition towards a circular business model. Some directions for further research have been outlined, as well.",The Global Platform Economy: A New Offshoring Institution Enabling Emerging-Economy Microproviders,"Global online platforms match firms with service providers around the world, in services ranging from software development to copywriting and graphic design. Unlike in traditional offshore outsourcing, service providers are predominantly one-person microproviders located in emerging-economy countries not necessarily associated with offshoring and often disadvantaged by negative country images. How do these microproviders survive and thrive? We theorize global platforms through transaction cost economics (TCE), arguing that they are a new technology-enabled offshoring institution that emerges in response to cross-border information asymmetries that hitherto prevented microproviders from participating in offshoring markets. To explain how platforms achieve this, we adapt signaling theory to a TCE-based model and test our hypotheses by analyzing 6 months of transaction records from a leading platform. To help interpret the results and generalize them beyond a single platform, we introduce supplementary data from 107 face-to-face interviews with microproviders in Southeast Asia and Sub-Saharan Africa. Individuals choose microprovidership when it provides a better return on their skills and labor than employment at a local (offshoring) firm. The platform acts as a signaling environment that allows microproviders to inform foreign clients of their quality, with platform-generated signals being the most informative signaling type. Platform signaling disproportionately benefits emerging-economy providers, allowing them to partly overcome the effects of negative country images and thus diminishing the importance of home country institutions. Global platforms in other factor and product markets likely promote cross-border microbusiness through similar mechanisms.",0.34200525283813477
National Health Care Spending In 2020: Growth Driven By Federal Spending In Response To The COVID-19 Pandemic.,"US health care spending increased 9.7 percent to reach $4.1 trillion in 2020, a much faster rate than the 4.3 percent increase seen in 2019. The acceleration in 2020 was due to a 36.0 percent increase in federal expenditures for health care that occurred largely in response to the COVID-19 pandemic. At the same time, gross domestic product declined 2.2 percent, and the share of the economy devoted to health care spending spiked, reaching 19.7 percent. In 2020 the number of uninsured people fell, while at the same time there were significant shifts in types of coverage.",The order of economic liberalization : financial control in the transition to a market economy,"Can knowledge of financial policies in developing countries over four decades help the socialist economies of Asia and Eastern Europe become open market economies in the 1990s? In all these countries the loss of fiscal and monetary control has often resulted in high inflation that undermines the liberalization process itself. In the second edition of The Order of Economic Liberalization, Ronald McKinnon builds on his influential work on the liberalization of financial markets in less developed countries and outlines the progression necessary to move from a ""repressed"" to an open economy. New to this edition are chapters that contrast the gradual Chinese approach to liberalizing domestic and foreign trade with the ""big bang"" approach followed by some Eastern European countries and republics of the former Soviet Union. Financial control and macroeconomic stability, McKinnon argues, are more critical to a successful transition than is any crash program to privatize state-owned industrial assets and the banking system.",0.05147212743759155
An Inquiry into the Nature and Causes of the Wealth of Nations,"It was the publication in 1776 of Adam Smith's Inquiry into the Nature and Causes of the Wealth of Nations that marked the beginning of the ideological revolution explored in this article. Political economy had been much debated in the previous hundred years, but Smith's formulation set the terms of discussion and over the next fifty years displaced a centuries-old rhetoric of economic values that had celebrated moderation, restraint, stewardship, and charity over greed, lust, and self-interest. During the American revolutionary era, when restless colonial elites began crafting explanations for their independence project, the publication of Smith's treatise on political economy put into play a new framework for considering the wealth of nations. This new framework resonated as a scientific discourse alongside the equally important new ""science of politics"" made famous by the revolutionary Whigs. It resonated as well with the new sciences of nature that lately had been exposing immutable ""laws"" by which human beings now explained their physical world. In each realm-economy, politics, and the natural world-scientific reasoning promised to disable the tyranny of ancient prerogatives, superstitions, illegitimate customs, and fantastical explanations. These new scientific perspectives sometimes intersected directly and sometimes influenced each other only by induction.",Information rules - a strategic guide to the network economy,"From the Publisher: Information Goods -- from movies and music to software code and stock quotes - have supplanted industrial goods as the key drivers of world markets. Confronted by this New Economy, many instinctively react by searching for a corresponding New Economics to guide their business decisions. Executives charged with rolling out cutting-edge software products or on-line versions of their magazines are tempted to abandon the classic lessons of economics, and rely instead on an ever changing roster of trends, buzzwords, and analogies that promise to guide strategy in the information age. Not so fast, say authors Carl Shapiro and Hal R. Varian. In Information Rules they warn managers, ""Ignore basic economic principles at your own risk. Technology changes. Economic laws do not."" Understanding these laws and their relevance to information goods is critical when fashioning today's successful competitive strategies. Information Rules introduces and explains the economic concepts needed to navigate the evolving network economy. Information Rules will help business leaders and policy makers - from executives in the entertainment, publishing, hardware, and software industries to lawyers, finance professionals, and writers -- make intelligent decisions about their information assets.",0.3468908667564392
The New Global Economy and Developing Countries: Making Openness Work,"Policy makers in the developing world are grappling with new dilemmas created by openness to trade and capital flows. What role, if any, remains for the state in promoting industrialization? Does openness worsen inequality, and if so, what can be done about it? What is the best way to handle turbulence from the world economy, especially the fickleness of international capital flows? In The New Global Economy and Developing Countries Dani Rodrik argues that successful integration into the world economy requires a complementary set of policies and institutions at home. Policy makers must reinforce their external strategy of liberalization with an internal strategy that gives the state substantial responsibility in building physical and human capital and mediating social conflicts.","Mental Health: Culture, Race, and Ethnicity-A Supplement to Mental Health: A Report of the Surgeon General","Mental health is fundamental to health, according to Mental Health: A Report of the Surgeon General, the first Surgeon General's report ever to focus exclusively on mental health. That report of two years ago urged Americans to view mental health as paramount to personal well-being, family relationships, and successful contributions to society. It documented the disabling nature of mental illnesses, showcased the strong science base behind effective treatments, and recommended that people seek help for mental health problems or disorders. The first mental health report also acknowledged that all Americans do not share equally in the hope for recovery from mental illnesses. This is especially true of members of racial and ethnic minority groups. That awareness galvanized me to ask for a supplemental report on the nature and extent of disparities in mental health care for racial and ethnic minorities and on promising directions for the elimination of these disparities. This Supplement documents that the science base on racial and ethnic minority mental health is inadequate; the best available research, however, indicates that these groups have less access to and avail-ability of care, and tend to receive poorer quality mental health services. These disparities leave minority communities with a greater disability burden from unmet mental health needs. A hallmark of this Supplement is its emphasis on the role that cultural factors play in mental health. The cultures from which people hail affect all aspects of mental health and illness, including the types of stresses they confront, whether they seek help, what types of help they seek, what symptoms and concerns they bring to clinical attention, and what types of coping styles and social supports they possess. Likewise, the cultures of clinicians and service systems influence the nature of mental health services.",0.08808583766222
Implicit Racial/Ethnic Bias Among Health Care Professionals and Its Influence on Health Care Outcomes: A Systematic Review.,"BACKGROUND In the United States, people of color face disparities in access to health care, the quality of care received, and health outcomes. The attitudes and behaviors of health care providers have been identified as one of many factors that contribute to health disparities. Implicit attitudes are thoughts and feelings that often exist outside of conscious awareness, and thus are difficult to consciously acknowledge and control. These attitudes are often automatically activated and can influence human behavior without conscious volition. OBJECTIVES We investigated the extent to which implicit racial/ethnic bias exists among health care professionals and examined the relationships between health care professionals' implicit attitudes about racial/ethnic groups and health care outcomes. SEARCH METHODS To identify relevant studies, we searched 10 computerized bibliographic databases and used a reference harvesting technique. SELECTION CRITERIA We assessed eligibility using double independent screening based on a priori inclusion criteria. We included studies if they sampled existing health care providers or those in training to become health care providers, measured and reported results on implicit racial/ethnic bias, and were written in English. DATA COLLECTION AND ANALYSIS We included a total of 15 studies for review and then subjected them to double independent data extraction. Information extracted included the citation, purpose of the study, use of theory, study design, study site and location, sampling strategy, response rate, sample size and characteristics, measurement of relevant variables, analyses performed, and results and findings. We summarized study design characteristics, and categorized and then synthesized substantive findings. MAIN RESULTS Almost all studies used cross-sectional designs, convenience sampling, US participants, and the Implicit Association Test to assess implicit bias. Low to moderate levels of implicit racial/ethnic bias were found among health care professionals in all but 1 study. These implicit bias scores are similar to those in the general population. Levels of implicit bias against Black, Hispanic/Latino/Latina, and dark-skinned people were relatively similar across these groups. Although some associations between implicit bias and health care outcomes were nonsignificant, results also showed that implicit bias was significantly related to patient-provider interactions, treatment decisions, treatment adherence, and patient health outcomes. Implicit attitudes were more often significantly related to patient-provider interactions and health outcomes than treatment processes. CONCLUSIONS Most health care providers appear to have implicit bias in terms of positive attitudes toward Whites and negative attitudes toward people of color. Future studies need to employ more rigorous methods to examine the relationships between implicit bias and health care outcomes. Interventions targeting implicit attitudes among health care professionals are needed because implicit bias may contribute to health disparities for people of color.","Community health workers in low-, middle-, and high-income countries: an overview of their history, recent evolution, and current effectiveness.","Over the past half-century, community health workers (CHWs) have been a growing force for extending health care and improving the health of populations. Following their introduction in the 1970s, many large-scale CHW programs declined during the 1980s, but CHW programs throughout the world more recently have seen marked growth. Research and evaluations conducted predominantly during the past two decades offer compelling evidence that CHWs are critical for helping health systems achieve their potential, regardless of a country's level of development. In low-income countries, CHWs can make major improvements in health priority areas, including reducing childhood undernutrition, improving maternal and child health, expanding access to family-planning services, and contributing to the control of HIV, malaria, and tuberculosis infections. In many middle-income countries, most notably Brazil, CHWs are key members of the health team and essential for the provision of primary health care and health promotion. In the United States, evidence indicates that CHWs can contribute to reducing the disease burden by participating in the management of hypertension, in the reduction of cardiovascular risk factors, in diabetes control, in the management of HIV infection, and in cancer screening, particularly with hard-to-reach subpopulations. This review highlights the history of CHW programs around the world and their growing importance in achieving health for all.",0.2952427864074707
Integrating Data On Social Determinants Of Health Into Electronic Health Records.,"As population health becomes more of a focus of health care, providers are realizing that data outside of traditional clinical findings can provide a broader perspective on potential drivers of a patient's health status and can identify approaches to improving the effectiveness of care. However, many challenges remain before data related to the social determinants of health, such as environmental conditions and education levels, are as readily accessible and actionable as medical data are. Key challenges are a lack of consensus on standards for capturing or representing social determinants of health in electronic health records and insufficient evidence that once information on them has been collected, social determinants can be effectively addressed through referrals or other action tools. To address these challenges and effectively use social determinants in health care settings, we recommend creating national standards for representing data related to social determinants of health in electronic health records, incentivizing the collection of the data through financial or quality measures, and expanding the body of research that measures the impact of acting on the information collected.",A Conceptual and Operational Definition of Personal Innovativeness in the Domain of Information Technology,"The acceptance of new information technologies by their intended users persists as an important issue for researchers and practitioners of information systems. Several models have been developed in the literature to facilitate understanding of the process by which new information technologies are adopted. This paper proposes a new construct that further illuminates the relationships explicit in the technology acceptance models and describes an operational measure for this construct that possesses desirable psychometric properties. The construct, personal innovativeness in the domain of information technology, is hypothesized to exhibit moderating effects on the antecedents as well as the consequences of individual perceptions about a new information technology. The construct was developed and validated in the context of the innovation represented by the World-Wide Web. Implications for theory and practice are discussed.",0.23116371035575867
