title1,abstract1,title2,abstract2,pseudo-label
The mental health continuum: from languishing to flourishing in life.,"This paper introduces and applies an operationalization of mental health as a syndrome of symptoms of positive feelings and positive functioning in life. Dimensions and scales of subjective well-being are reviewed and conceived of as mental health symptoms. A diagnosis of the presence of mental health, described as flourishing, and the absence of mental health, characterized as languishing, is applied to data from the 1995 Midlife in the United States study of adults between the ages of 25 and 74 (n = 3,032). Findings revealed that 17.2 percent fit the criteria for flourishing, 56.6 percent were moderately mentally healthy, 12.1 percent of adults fit the criteria for languishing, and 14.1 percent fit the criteria for DSM-III-R major depressive episode (12-month), of which 9.4 percent were not languishing and 4.7 percent were also languishing. The risk of a major depressive episode was two times more likely among languishing than moderately mentally healthy adults, and nearly six times greater among languishing than flourishing adults. Multivariate analyses revealed that languishing and depression were associated with significant psychosocial impairment in terms of perceived emotional health, limitations of activities of daily living, and workdays lost or cutback. Flourishing and moderate mental health were associated with superior profiles of psychosocial functioning. The descriptive epidemiology revealed that males, older adults, more educated individuals, and married adults were more likely to be mentally healthy. Implications for the conception of mental health and the treatment and prevention of mental illness are discussed.",Using Electronic Health Records for Population Health Research: A Review of Methods and Applications.,"The use and functionality of electronic health records (EHRs) have increased rapidly in the past decade. Although the primary purpose of EHRs is clinical, researchers have used them to conduct epidemiologic investigations, ranging from cross-sectional studies within a given hospital to longitudinal studies on geographically distributed patients. Herein, we describe EHRs, examine their use in population health research, and compare them with traditional epidemiologic methods. We describe diverse research applications that benefit from the large sample sizes and generalizable patient populations afforded by EHRs. These have included reevaluation of prior findings, a range of diseases and subgroups, environmental and social epidemiology, stigmatized conditions, predictive modeling, and evaluation of natural experiments. Although studies using primary data collection methods may have more reliable data and better population retention, EHR-based studies are less expensive and require less time to complete. Future EHR epidemiology with enhanced collection of social/behavior measures, linkage with vital records, and integration of emerging technologies such as personal sensing could improve clinical care and population health.",0.19871821999549866
"Measuring social class in US public health research: concepts, methodologies, and guidelines.","Increasing social inequalities in health in the United States and elsewhere, coupled with growing inequalities in income and wealth, have refocused attention on social class as a key determinant of population health. Routine analysis using conceptually coherent and consistent measures of socioeconomic position in US public health research and surveillance, however, remains rare. This review discusses concepts and methodologies concerning, and guidelines for measuring, social class and other aspects of socioeconomic position (e.g. income, poverty, deprivation, wealth, education). These data should be collected at the individual, household, and neighborhood level, to characterize both childhood and adult socioeconomic position; fluctuations in economic resources during these time periods also merit consideration. Guidelines for linking census-based socioeconomic measures and health data are presented, as are recommendations for analyses involving social class, race/ethnicity, and gender. Suggestions for research on socioeconomic measures are provided, to aid monitoring steps toward social equity in health.","Knowledge of the Firm, Combinative Capabilities, and the Replication of Technology","How should we understand why firms exist? A prevailing view has been that they serve to keep in check the transaction costs arising from the self-interested motivations of individuals. We develop in this article the argument that what firms do better than markets is the sharing and transfer of the knowledge of individuals and groups within an organization. This knowledge consists of information (e.g., who knows what) and of know-how (e.g., how to organize a research team). What is central to our argument is that knowledge is held by individuals, but is also expressed in regularities by which members cooperate in a social community (i.e., group, organization, or network). If knowledge is only held at the individual level, then firms could change simply by employee turnover. Because we know that hiring new workers is not equivalent to changing the skills of a firm, an analysis of what firms can do must understand knowledge as embedded in the organizing principles by which people cooperate within organizations.Based on this discussion, a paradox is identified: efforts by a firm to grow by the replication of its technology enhances the potential for imitation. By considering how firms can deter imitation by innovation, we develop a more dynamic view of how firms create new knowledge. We build up this dynamic perspective by suggesting that firms learn new skills by recombining their current capabilities. Because new ways of cooperating cannot be easily acquired, growth occurs by building on the social relationships that currently exist in a firm. What a firm has done before tends to predict what it can do in the future. In this sense, the cumulative knowledge of the firm provides options to expand in new but uncertain markets in the future.We discuss at length the example of the make/buy decision and propose several testable hypotheses regarding the boundaries of the firm, without appealing to the notion of ""opportunism.""",-0.0021111350506544113
What is the meaning of health literacy? A systematic review and qualitative synthesis,"The objective of this review was to clarify what health literacy represents. A systematic review with qualitative syntheses was performed (CRD42017065149). Studies concerning health literacy in all settings were included. Studies before 15 March 2017 were identified from PubMed, Medline, Embase, Web of Science, Scopus, PsycARTICLES and the Cochrane Library. The included literature either had defined the concept of health literacy or made a detailed explanation of health literacy. A total of 34 original studies met the inclusion criteria, including 13 involved in previous systematic reviews and 21 new studies. Health literacy was commonly conceptualised as a set of knowledge, a set of skills or a hierarchy of functions (functional-interactive-critical). The construct of health literacy covers three broad elements: (1) knowledge of health, healthcare and health systems; (2) processing and using information in various formats in relation to health and healthcare; and (3) ability to maintain health through self-management and working in partnerships with health providers. Health literacy is defined as the ability of an individual to obtain and translate knowledge and information in order to maintain and improve health in a way that is appropriate to the individual and system contexts. This definition highlights the diversity of needs from different individuals and the importance of interactions between individual consumers, healthcare providers and healthcare systems.","Stigma, mental health, and resilience in an online sample of the US transgender population.","OBJECTIVES We assessed the association between minority stress, mental health, and potential ameliorating factors in a large, community-based, geographically diverse sample of the US transgender population. METHODS In 2003, we recruited through the Internet a sample of 1093 male-to-female and female-to-male transgender persons, stratified by gender. Participants completed an online survey that included standardized measures of mental health. Guided by the minority stress model, we evaluated associations between stigma and mental health and tested whether indicators of resilience (family support, peer support, identity pride) moderated these associations. RESULTS Respondents had a high prevalence of clinical depression (44.1%), anxiety (33.2%), and somatization (27.5%). Social stigma was positively associated with psychological distress. Peer support (from other transgender people) moderated this relationship. We found few differences by gender identity. CONCLUSIONS Our findings support the minority stress model. Prevention needs to confront social structures, norms, and attitudes that produce minority stress for gender-variant people; enhance peer support; and improve access to mental health and social services that affirm transgender identity and promote resilience.",0.1554013192653656
Blockchain technology and its relationships to sustainable supply chain management,"Globalisation of supply chains makes their management and control more difficult. Blockchain technology, as a distributed digital ledger technology which ensures transparency, traceability, and security, is showing promise for easing some global supply chain management problems. In this paper, blockchain technology and smart contracts are critically examined with potential application to supply chain management. Local and global government, community, and consumer pressures to meet sustainability goals prompt us to further investigate how blockchain can address and aid supply chain sustainability. Part of this critical examination is how blockchains, a potentially disruptive technology that is early in its evolution, can overcome many potential barriers. Four blockchain technology adoption barriers categories are introduced; inter-organisational, intra-organisational, technical, and external barriers. True blockchain-led transformation of business and supply chain is still in progress and in its early stages; we propose future research propositions and directions that can provide insights into overcoming barriers and adoption of blockchain technology for supply chain management.",Mental health literacy: empowering the community to take action for better mental health.,"For major physical diseases, it is widely accepted that members of the public will benefit by knowing what actions they can take for prevention, early intervention, and treatment. However, this type of public knowledge about mental disorders (mental health literacy) has received much less attention. There is evidence from surveys in several countries for deficiencies in (a) the public's knowledge of how to prevent mental disorders, (b) recognition of when a disorder is developing, (c) knowledge of help-seeking options and treatments available, (d) knowledge of effective self-help strategies for milder problems, and (e) first aid skills to support others affected by mental health problems. Nevertheless, there is evidence that a range of interventions can improve mental health literacy, including whole-of-community campaigns, interventions in educational settings, Mental Health First Aid training, and information websites. There is also evidence for historical improvements in mental health literacy in some countries. Increasing the community's mental health literacy needs to be a focus for national policy and population monitoring so that the whole community is empowered to take action for better mental health.",0.10267423093318939
Atom Economy-A Challenge for Organic Synthesis: Homogeneous Catalysis Leads the Way,"Enhancing the efficiency of the synthesis of complex organic products constitutes one of the most exciting challenges to the synthetic chemist. Increasing the catalogue of reactions that are simple additions or that minimize waste production is the necessary first step. Transition metal complexes, which can be tunable both electronically and sterically by varying the metal and/or ligands, are a focal point for such invention. Except for catalytic hydrogenation, such methods have been rare in complex synthesis and virtually unknown for CC bond formation until the advent of cross-coupling reactions. These complexes may orchestrate a variety of CC bond-forming processes, important for creation of the basic skeleton of the organic structure. Their ability to insert into CH bonds primes a number of different types of additions to relatively nonpolar π-electron systems. Besides imparting selectivity, they make feasible reactions that uncatalyzed were previously unknown. The ability of these complexes to preorganize π-electron systems serves as the basis both of simple additions usually accompanied by subsequent hydrogen shifts and of cycloadditions. The ability to generate ""reactive"" intermediates under mild conditions also provides prospects for new types of CC bond-forming reactions. While the examples reveal a diverse array of successes, the opportunities for new invention are vast and largely untapped.",Review of community-based research: assessing partnership approaches to improve public health.,"Community-based research in public health focuses on social, structural, and physical environmental inequities through active involvement of community members, organizational representatives, and researchers in all aspects of the research process. Partners contribute their expertise to enhance understanding of a given phenomenon and to integrate the knowledge gained with action to benefit the community involved. This review provides a synthesis of key principles of community-based research, examines its place within the context of different scientific paradigms, discusses rationales for its use, and explores major challenges and facilitating factors and their implications for conducting effective community-based research aimed at improving the public's health.",-0.014982798136770725
"Climate change and mental health: risks, impacts and priority actions","BackgroundThis article provides an overview of the current and projected climate change risks and impacts to mental health and provides recommendations for priority actions to address the mental health consequences of climate change.Discussion and conclusionThe authors argue the following three points: firstly, while attribution of mental health outcomes to specific climate change risks remains challenging, there are a number of opportunities available to advance the field of mental health and climate change with more empirical research in this domain; secondly, the risks and impacts of climate change on mental health are already rapidly accelerating, resulting in a number of direct, indirect, and overarching effects that disproportionally affect those who are most marginalized; and, thirdly, interventions to address climate change and mental health need to be coordinated and rooted in active hope in order to tackle the problem in a holistic manner. This discussion paper concludes with recommendations for priority actions to address the mental health consequences of climate change.",The benefits of health information technology: a review of the recent literature shows predominantly positive results.,"An unprecedented federal effort is under way to boost the adoption of electronic health records and spur innovation in health care delivery. We reviewed the recent literature on health information technology to determine its effect on outcomes, including quality, efficiency, and provider satisfaction. We found that 92 percent of the recent articles on health information technology reached conclusions that were positive overall. We also found that the benefits of the technology are beginning to emerge in smaller practices and organizations, as well as in large organizations that were early adopters. However, dissatisfaction with electronic health records among some providers remains a problem and a barrier to achieving the potential of health information technology. These realities highlight the need for studies that document the challenging aspects of implementing health information technology more specifically and how these challenges might be addressed.",0.10157182812690735
"Principles of Political Economy with Some of Their Applications to Social Philosophy, 2 Vols.","Get Principles Of Political Economy With Some Of Their Applications To Social Philosophy Download PDF ebooks you may be thinking of and study to see internet sites giving e-books downloads. This site is mainly for students, programmers and tech geeks, we present Principles Of Political Economy With Some Of Their Applications To Social Philosophy and wide variety below pc science, programming, os, etc. Before getting any kind of book guarantee if it has been printed in e-book structure since if not then very impossible you'll find it on the internet, book Principles Of Political Economy With Some Of Their Applications To Social Philosophy Download PDF is ready for obtain twenty four hours per day on our platform. If you're interested in engineering or like to understand to program free of charge and then this amazing site is for you it includes a large number of technology publications you can get most of the publications related to computer like development publications, os Principles Of Political Economy With Some Of Their Applications To Social Philosophy Download PDF. Publications can be found in a few types, and you can also have a look at ratings and opinions from other people, one of the most used Principles Of Political Economy With Some Of Their Applications To Social Philosophy. To get Principles Of Political Economy With Some Of Their Applications To Social Philosophy no enrollment or cost is required, and books can be found in ePub, Kindle, HTML, and simple text formats. Provide publications away. Get Principles Of Political Economy With Some Of Their Applications To Social Philosophy you want. Good fiction must be shared with friends, if you love something you are studying, allow them know if you prefer Principles Of Political Economy With Some Of Their Applications To Social Philosophy Download PDF. The internet sites is definitely an open, editable selection list to read free Principles Of Political Economy With Some Of Their Applications To Social Philosophy Download PDF online. The free Principles Of Political Economy With Some Of Their Applications To Social Philosophy Download PDF obtain pdf without subscription site has a big variety of new fiction, non-fiction, and also audiobooks at your fingertips, atlanta divorce attorneys variety you might hope for. Your one-stop alternative for examining Principles Of Political Economy With Some Of Their Applications To Social Philosophy Download PDF online free. If you are having problem accessing Principles Of Political Economy With Some Of Their Applications To Social Philosophy guide or if the hyperlinks aren't functioning, please write to email. We shall revise it, or deliver it for you by email. The Principles Of Political Economy With Some Of Their Applications To Social Philosophy will be a popular guide, can be easily within a library. As that Principles Of Political Economy With Some Of Their Applications To Social Philosophy, it ends happening swine one of the favored ebook Principles Of Political Economy With Some Of Their Applications To Social Philosophy libraries that people have. This is the reason you stay in the most effective site to see the fantastic publications to have. Yeah, reviewing an ebook","The rise of the ""just-in-time workforce"": on-demand work, crowdwork and labour protection in the ""gig-economy""","The so-called ""gig-economy"" has been growing exponentially in numbers and importance in recent years but its impact on labour rights has been largely overlooked. Forms of work in the ""gig-economy"" include ""crowdwork"", and ""work-on-demand via apps"", under which the demand and supply of working activities is matched online or via mobile apps. These forms of work can provide a good match of job opportunities and allow flexible working schedules. However, they can also pave the way to a severe commodification of work. This paper discusses the implications of this commodification and advocates the full recognition of activities in the gig-economy as ""work"".",0.3115207552909851
Grundrisse : foundations of the critique of political economy (rough draft),"Written during the winter of 1857-8, the ""Grundrisse"" was considered by Marx to be the first scientific elaboration of communist theory. A collection of seven notebooks on capital and money, it both develops the arguments outlined in the Communist Manifesto (1848) and explores the themes and theses that were to dominate his great later work ""Capital"". Here, for the first time, Marx set out his own version of Hegel's dialectics and developed his mature views on labour, surplus value and profit, offering many fresh insights into alienation, automation and the dangers of capitalist society. Yet while the theories in ""Grundrisse"" make it a vital precursor to ""Capital"", it also provides invaluable descriptions of Marx's wider-ranging philosophy, making it a unique insight into his beliefs and hopes for the foundation of a communist state.",Using PLS path modeling in new technology research: updated guidelines,"Purpose - Partial least squares (PLS) path modeling is a variance-based structural equation modeling (SEM) technique that is widely applied in business and social sciences. Its ability to model composites and factors makes it a formidable statistical tool for new technology research. Recent reviews, discussions, and developments have led to substantial changes in the understanding and use of PLS. The paper aims to discuss these issues. Design/methodology/approach - This paper aggregates new insights and offers a fresh look at PLS path modeling. It presents new developments, such as consistent PLS, confirmatory composite analysis, and the heterotrait-monotrait ratio of correlations. Findings - PLS path modeling is the method of choice if a SEM contains both factors and composites. Novel tests of exact fit make a confirmatory use of PLS path modeling possible. Originality/value - This paper provides updated guidelines of how to use PLS and how to report and interpret its results.",0.04073604941368103
Evidence suggesting that a chronic disease self-management program can improve health status while reducing hospitalization: a randomized trial.,"OBJECTIVES This study evaluated the effectiveness (changes in health behaviors, health status, and health service utilization) of a self-management program for chronic disease designed for use with a heterogeneous group of chronic disease patients. It also explored the differential effectiveness of the intervention for subjects with specific diseases and comorbidities. METHODS The study was a six-month randomized, controlled trial at community-based sites comparing treatment subjects with wait-list control subjects. Participants were 952 patients 40 years of age or older with a physician-confirmed diagnosis of heart disease, lung disease, stroke, or arthritis. Health behaviors, health status, and health service utilization, as determined by mailed, self-administered questionnaires, were measured. RESULTS Treatment subjects, when compared with control subjects, demonstrated improvements at 6 months in weekly minutes of exercise, frequency of cognitive symptom management, communication with physicians, self-reported health, health distress, fatigue, disability, and social/role activities limitations. They also had fewer hospitalizations and days in the hospital. No differences were found in pain/physical discomfort, shortness of breath, or psychological well-being. CONCLUSIONS An intervention designed specifically to meet the needs of a heterogeneous group of chronic disease patients, including those with comorbid conditions, was feasible and beneficial beyond usual care in terms of improved health behaviors and health status. It also resulted in fewer hospitalizations and days of hospitalization.",New Tools in Comparative Political Economy : The Database of Political Institutions,"This article introduces a large new cross-country database, the Database of Political Institutions. It covers 177 countries over 21 years, 1975-95. The article presents the intuition, construction, and definitions of the different variables. Among the novel variables introduced are several measures of checks and balances, tenure and stability, identification of party affiliation with government or opposition, and fragmentation of opposition and government parties in the legislature.",0.02631509304046631
